{"author":"tianjun-ai-master","capabilities":["theme.css","theme.logo","theme.favicon","theme.app_title","theme.css_variables","theme.hidden_menus","frontend.i18n","frontend.static"],"created_at":"2026-05-09T00:00:00+00:00","customer_code":"internal-demo","description":"Tier 1 示例：替换品牌色、Logo、Favicon、标题与少量 i18n 文案。","files_digest":"sha256:eca4b3c8fccba24c19592407284bc3674e291bf0de3306bec61c875474f0201e","frontend":{"hidden_menus":["/alarm"],"i18n":{"en-US":"frontend/i18n/en-US.json","zh-CN":"frontend/i18n/zh-CN.json"},"static_dir":"frontend/assets","theme":{"app_title":"ACME AI Vision","css":"frontend/theme.css","css_variables":{"--tj-bg-page":"#020617","--tj-primary":"#38bdf8","--tj-primary-hover":"#0ea5e9","--tj-text-main":"#e2e8f0"},"favicon":"frontend/assets/favicon.svg","logo":"frontend/assets/logo.svg"}},"main_version_max":"3.x","main_version_min":"3.7.0","manifest_version":1,"metadata":{"doc":"docs/plugin-system/design/04_tier1_theme.md","example":true},"name":"ACME White Label Theme","plugin_version":"1.0.0","requires":{"gpu":false,"python_packages":[]},"runtime":{"background_thread_max_count":0,"cpu_threshold_warn_pct":5,"max_hook_duration_ms":1000,"memory_threshold_warn_mb":80},"signed_at":"1970-01-01T00:00:00+00:00","signed_by":"unsigned-dev-build","tier":1}