{"author":"tianjun-ai-master","backend":{"entry":"backend/__init__.py","tables":[{"class_name":"PluginLgWorktimeCycleLean","module":"backend.models","name":"p_lg_worktime_cycle_lean"}]},"capabilities":["frontend.theme","frontend.i18n","backend.routers","backend.hooks","backend.tables","backend.export.field_resolvers"],"created_at":"2026-08-04T05:00:00+00:00","customer_code":"lg-worktime","description":"LG 客户专属 — 领导工时看板 (Monitor) + 展会风格其它 7 页: LEAN VA/BVA/NVA、CT/步骤/趋势; 项目/模型/源/数据/MES/报警/设置复用展会全应用界面; 检测主页配色对齐展会 HUD, KPI 数值结构不变; LG 口径全参数可配: 每步骤动作价值在项目管理·步骤设置, 默认价值/等待归类/统计范围/趋势天数在系统设置·LG 工时参数","files_digest":"sha256:12de67b5557e973ced227118ff70ef965ef72cd50165789ef200a9110e5a3f68","frontend":{"entry":"frontend/dist/index.esm.js","i18n":{"en-US":"frontend/i18n/en-US.json","zh-CN":"frontend/i18n/zh-CN.json"},"static_dir":"frontend/dist","theme":{"app_title":"天军科技 · AI 工时测量系统","css":"frontend/dist/theme.css"}},"main_version_max":"3.x","main_version_min":"3.46.0","manifest_version":1,"metadata":{"doc":"plugins-examples/lg-worktime/README.md","example":false,"layout":"leader-dashboard+showcase-pages","slot":"monitor.layout.body + *.layout.body"},"name":"LG 工时看板","plugin_version":"1.5.3","requires":{"gpu":false,"python_packages":[]},"runtime":{"background_thread_max_count":0,"cpu_threshold_warn_pct":5,"max_hook_duration_ms":1000,"memory_threshold_warn_mb":80},"signed_at":"1970-01-01T00:00:00+00:00","signed_by":"unsigned-dev-build","tier":3}