{"author":"tianjun-ai-master","backend":{"entry":"backend/__init__.py","hooks":[{"function":"on_cycle_end_post","module":"backend.hooks","phase":"post_cycle","priority":100,"type":"cycle_end","when":"post"}],"routers":[{"attr":"router","module":"backend.routes","subpath":"demo"}],"tables":[{"class_name":"PluginInspectionNote","module":"backend.models","name":"p_internal_demo_notes"}]},"capabilities":["frontend.i18n","backend.routers","backend.hooks","backend.tables","backend.export.templates"],"created_at":"2026-05-09T00:00:00+00:00","customer_code":"internal-demo","default_config":{"plugin.internal-demo.enabled":true,"plugin.internal-demo.note_prefix":"DEMO"},"description":"Tier 3 示例：后端 API、cycle_end hook、ORM 表与导出模板。","export":{"templates":[{"file":"templates/cycle_summary.txt","format":"txt","name":"internal-demo-cycle-summary"}]},"files_digest":"sha256:02eff7736d8a69b7838fb4a9bd40c109a40337669f5137f6580870044ec650df","frontend":{"i18n":{"zh-CN":"frontend/i18n/zh-CN.json"}},"main_version_max":"3.x","main_version_min":"3.7.0","manifest_version":1,"metadata":{"doc":"docs/plugin-system/design/06_tier3_fullstack.md","example":true},"name":"Fullstack MES Extension","plugin_version":"1.0.0","requires":{"gpu":false,"python_packages":[],"python_version":">=3.10,<3.11"},"runtime":{"background_thread_max_count":0,"cpu_threshold_warn_pct":15,"max_hook_duration_ms":3000,"memory_threshold_warn_mb":160},"signed_at":"1970-01-01T00:00:00+00:00","signed_by":"unsigned-dev-build","tier":3}