{"author":"tianjun-ai-master","capabilities":["frontend.theme","frontend.i18n","frontend.stores"],"created_at":"2026-06-02T20:23:06.705831+00:00","customer_code":"showcase","description":"展会展示用 — 整应用 8 页高科技重设计 (RFC12 整页覆盖 slot): 全站接真后端, 读写全链路与主程序等价, 空库真实空状态. v1.2.2: 品牌 logo 圆角化替换 + 当前页面/运行态上移顶栏(状态栏腾空间给节拍) + 控制按钮反馈/清零/保存提示等细节修复 (含 v1.2.x 全功能真实化系列).","files_digest":"sha256:8fd8f5884fb657b0e308446af746e0c2601166bc818f393e899d3a6b7f4f3bbd","frontend":{"entry":"frontend/dist/index.esm.js","i18n":{"en-US":"frontend/i18n/en-US.json","zh-CN":"frontend/i18n/zh-CN.json"},"static_dir":"frontend/dist","theme":{"app_title":"天军科技 · AI 视觉行为分析防错检测系统","css":"frontend/dist/theme.css"}},"main_version_max":"3.x","main_version_min":"3.13.0","manifest_version":1,"metadata":{"doc":"plugins-examples/tianjun-showcase/README.md","example":false,"layout":"showcase-full-app","slot":"all.layout.body"},"name":"天军 展会 全应用定制界面","plugin_version":"1.2.2","requires":{"gpu":false,"python_packages":[]},"runtime":{"background_thread_max_count":0,"cpu_threshold_warn_pct":5,"max_hook_duration_ms":1000,"memory_threshold_warn_mb":120},"signed_at":"2026-06-11T04:57:36.786082+00:00","signed_by":"tianjun-ai-master","tier":2}