{"author":"tianjun-ai-master","capabilities":["theme.logo","frontend.routes","frontend.menus","frontend.stores","frontend.i18n","frontend.static"],"created_at":"2026-05-09T00:00:00+00:00","customer_code":"internal-demo","description":"Tier 2 示例：新增一个客户看板路由、菜单项与 Pinia store。","files_digest":"sha256:93018127dd37fb5c9a5f4bbcabff160a76edd9a2ade822028f61328deb42462b","frontend":{"entry":"frontend/dist/index.esm.js","i18n":{"en-US":"frontend/i18n/en-US.json","zh-CN":"frontend/i18n/zh-CN.json"},"menus":[{"i18n_key":"plugin.dashboard","icon":"DataAnalysis","label":"客户看板","order":80,"path":"/factory-dashboard"}],"routes":[{"component":"DashboardView","icon":"DataAnalysis","menu_label":"客户看板","name":"factory-dashboard","order":80,"path":"factory-dashboard","permissions":[]}],"static_dir":"frontend/dist","stores":[{"id":"plugin-internal-demo-dashboard","module":"frontend/dist/index.esm.js"}],"theme":{"app_title":"Factory Dashboard","logo":"frontend/dist/logo.svg"}},"main_version_max":"3.x","main_version_min":"3.7.0","manifest_version":1,"metadata":{"doc":"docs/plugin-system/design/05_tier2_ui.md","example":true},"name":"Factory Dashboard UI","plugin_version":"1.0.0","requires":{"gpu":false,"python_packages":[]},"runtime":{"background_thread_max_count":0,"cpu_threshold_warn_pct":10,"max_hook_duration_ms":1000,"memory_threshold_warn_mb":120},"signed_at":"1970-01-01T00:00:00+00:00","signed_by":"unsigned-dev-build","tier":2}