{"author":"tianjun-ai-master","capabilities":["frontend.i18n","frontend.slots","frontend.tabs","backend.hooks","backend.routers","runtime.alarm_trigger","runtime.event_trigger","runtime.system_config_write"],"created_at":"2026-06-26T00:00:00+00:00","customer_code":"sensor-clean","description":"传感器清洁工序定制 — 双视角监控整页覆盖 + 项目配置 Tab + 棉签寿命约束 + 跨视角联动。v1.1.3 超限后每件不良持续红灯+蜂鸣报警 + 一键导入不再清空已存配置(修保存回退) + 看板离岗告警条。v1.2.0 选择性抑制(仅盖系统自带OK/NG提示框, 自定义事件提示框仍展示有效) + 棉签使用记录数据页(整页覆盖数据中心: 每根棉签生命周期记录/统计卡/图表/表格/CSV导出)。","files_digest":"sha256:20b327fca23afbf001545bae10d2a7bbaf881cbd14120a4f4af6e4e1974d49ea","frontend":{"entry":"frontend/dist/index.esm.js","i18n":{"en-US":"frontend/i18n/en-US.json","zh-CN":"frontend/i18n/zh-CN.json"},"static_dir":"frontend/dist"},"main_version_max":"3.x","main_version_min":"3.27.0","manifest_version":1,"metadata":{"doc":"plugins-examples/sensor-clean/README.md","example":true},"name":"传感器清洁工序","plugin_version":"1.2.0","requires":{"gpu":false,"python_packages":[]},"runtime":{"background_thread_max_count":0,"cpu_threshold_warn_pct":5,"max_hook_duration_ms":1000,"memory_threshold_warn_mb":80},"signed_at":"1970-01-01T00:00:00+00:00","signed_by":"unsigned-dev-build","tier":3}