{"author":"tianjun-ai-master","capabilities":["frontend.theme","frontend.i18n","frontend.stores"],"created_at":"2026-06-02T20:23:06.705831+00:00","customer_code":"showcase","description":"展会展示用 — 整应用 8 页高科技重设计 (RFC12 整页覆盖 slot), 全站接真后端. v1.5.1: 插件即主程序 — 鉴权写穿宿主 token / 显示设置接真 / 对齐 v3.56~v3.61 (容器定界/逐件开始判定/ROI多块/多码采集/OCR·异常/sidecar带框). 详见 UPGRADE_v1.5.1.md.","files_digest":"sha256:7d5d0fcf7e0e7198fe506769d844ac47357fba5562096e1e78bb8b439a44d675","frontend":{"entry":"frontend/dist/index.esm.js","i18n":{"en-US":"frontend/i18n/en-US.json","zh-CN":"frontend/i18n/zh-CN.json"},"static_dir":"frontend/dist","theme":{"app_title":"天军科技 · AI 视觉行为分析防错检测系统","css":"frontend/dist/theme.css"}},"main_version_max":"3.x","main_version_min":"3.61.0","manifest_version":1,"metadata":{"doc":"plugins-examples/tianjun-showcase/README.md","example":false,"layout":"showcase-full-app","slot":"all.layout.body"},"name":"天军 展会 全应用定制界面","plugin_version":"1.5.1","requires":{"gpu":false,"python_packages":[]},"runtime":{"background_thread_max_count":0,"cpu_threshold_warn_pct":5,"max_hook_duration_ms":1000,"memory_threshold_warn_mb":120},"signed_at":"2026-06-11T04:57:36.786082+00:00","signed_by":"tianjun-ai-master","tier":2}