{"author":"tianjun-ai-master","capabilities":["frontend.theme","frontend.i18n","frontend.stores","backend.hooks","backend.routers","runtime.alarm_trigger","runtime.system_config_write"],"created_at":"2026-05-29T14:00:00+00:00","customer_code":"internal-demo","description":"福建金龙客户专属 — 双工位检测主页 v1.3.0: 步骤耗时三档实时报警+判NG; OK/NG卡用插件权威统计(库内重算); 步骤设置表「耗时三档」配置单元格; 每步可选警告/NG触发哪个报警事件(驱动报警灯); v1.3.0 提示框升级为可选(不弹/内置/系统预设/自定义), 自绘套用显示设置样式(颜色/位置/文字/时长)","files_digest":"sha256:e9a7dff8b784cd02f1ea15285a27c55940e9de827f329f44e4ee8b9af559fd35","frontend":{"entry":"frontend/dist/index.esm.js","i18n":{"en-US":"frontend/i18n/en-US.json","zh-CN":"frontend/i18n/zh-CN.json"},"static_dir":"frontend/dist","theme":{"app_title":"天军科技 AI 视觉检测系统","css":"frontend/dist/theme.css"}},"main_version_max":"3.x","main_version_min":"3.15.0","manifest_version":1,"metadata":{"doc":"plugins-examples/fujian-jinlong/README.md","example":false,"layout":"dual-station","slot":"monitor.layout.body"},"name":"福建金龙 双工位检测主页","plugin_version":"1.3.0","requires":{"gpu":false,"python_packages":[]},"runtime":{"background_thread_max_count":0,"cpu_threshold_warn_pct":5,"max_hook_duration_ms":1000,"memory_threshold_warn_mb":80},"signed_at":"2026-06-01T15:19:05.209647+00:00","signed_by":"tianjun-ai-master","tier":2}